,Job Title,Company,Location,Requirements,Years of Experience,Tags,Link
377,Senior Data Scientist,Decision Point,Hybrid,Candidate should be research oriented and passionate to learn new technologies and adap...,3-8 Yrs," Time Series Analysis, time series, machine learning, Data Science, Arima",https://www.naukri.com/job-listings-senior-data-scientist-decision-point-gurgaon-gurugram-3-to-8-years-251122006543
378,Senior Data Scientist,SuccessR Hrtech Pvt Ltd,Temp. WFH,"Responsibilities:Design, Implement and Evaluate models and Design machine learning syst...",5-9 Yrs," Python, deep learning, lstm, cnn, nlp, rnn, data science, pytorch",https://www.naukri.com/job-listings-senior-data-scientist-successr-hrtech-pvt-ltd-bangalore-bengaluru-5-to-9-years-181122912352
379,Jr/Sr Data Scientist -  Product Company -Mumbai ( Remote working),Maestro Headhunters LLP,Mumbai,Open for candidates to work remotely Our client is one of the fastest-growing start-up ...,3-8 Yrs," Senior Data Scientist, Regression, Text Mining, Clustering, Machine Learning, Java, C++, C",https://www.naukri.com/job-listings-jr-sr-data-scientist-product-company-mumbai-remote-working-maestro-headhunters-llp-mumbai-all-areas-3-to-8-years-070919002423
380,Sr . Data Scientist,ORMAE (Operations Research Machine learning & Analytics Experts LLP),Bangalore,Must have experience of deploying data science / machine learning projects at scaleMini...,3-10 Yrs," machine learning, D3 js, Tableau, graph theory, predictive analytics, Spark, data structures, object - oriented programming",https://www.naukri.com/job-listings-sr-data-scientist-ormae-operations-research-machine-learning-analytics-experts-llp-bangalore-bengaluru-3-to-10-years-211122502556
381,Senior Data Scientist,3i Infotech,Hybrid,Roles and Responsibilities You will be the core members who would be designing the data...,3-6 Yrs," Data Science, Python, R, data sciencitist, Scala, Spark",https://www.naukri.com/job-listings-senior-data-scientist-3i-infotech-limited-chennai-3-to-6-years-181122608798
382,Senior Data Scientist,3i Infotech,Hybrid,Roles and Responsibilities You will be the core members who would be designing the data...,7-12 Yrs," Data Science, Python, DB, Tableau, Azure, Spark, R, Oracle",https://www.naukri.com/job-listings-senior-data-scientist-3i-infotech-limited-chennai-7-to-12-years-181122008796
383,Senior Data Scientist,Ganit Business Solutions,Multiple,"One of these 3 Bachelors / Masters degree in Engineering / Technology, an MBA or an MSc...",5-8 Yrs," Data Science, predictive modeling, python, Algorithm Analysis",https://www.naukri.com/job-listings-senior-data-scientist-ganit-business-solutions-private-limited-chennai-bangalore-bengaluru-5-to-8-years-171122008960
384,Data Scientist/Senior Data Scientist,Brahma Consulting Group,Hyderabad,"As Data Scientists, we work with business leaders to solve clients business challenges...",5-10 Yrs," Unix, Text mining, data science, Analytical, Consulting, Machine learning, Forecasting, SQL",https://www.naukri.com/job-listings-data-scientist-senior-data-scientist-brahma-consulting-group-hyderabad-secunderabad-5-to-10-years-251122501702
385,Senior Business Analyst,Flipkart,Bangalore,You will be required to,1-3 Yrs," Business analysis, Analytical, Analytics, SQL, Python, Root cause analysis, data science, ARM",https://www.naukri.com/job-listings-senior-business-analyst-flipkart-internet-private-limited-bangalore-bengaluru-1-to-3-years-011222905961
386,Sr Data Analyst,Boston Consulting Group,Bangalore,"To realize our digital transformation, we need to transform our products, experiences, ...",4-6 Yrs," Mining, Data analysis, Machine learning, Agile, Data analytics, data visualization, Forecasting, Data warehousing",https://www.naukri.com/job-listings-sr-data-analyst-boston-consulting-group-bangalore-bengaluru-4-to-6-years-251122502722
387,Sr Data Analyst,Boston Consulting Group,Bangalore,Must understand API integration using Python for extracting data from different sources...,4-6 Yrs," Text mining, Data analysis, Machine learning, Agile, Data analytics, Data Analyst, data visualization, Operations",https://www.naukri.com/job-listings-sr-data-analyst-boston-consulting-group-bangalore-bengaluru-4-to-6-years-251122502555
388,Data Architect,Atlas Copco,Pune,Collaborate with business colleagues to identify and define opportunities to use data t...,3-8 Yrs," Data dictionary, data science, Coding, Machine learning, Data collection, Manager Technology, power bi, Analytics",https://www.naukri.com/job-listings-data-architect-atlas-copco-i-ltd-pune-3-to-8-years-281122501731
389,Data Scientist,Vipsa Talent Solutions,Multiple,"Mandatory Skills - Data Science, Python for Data Science, Predictive Modelling/Recommen...",5-8 Yrs," Data Science, Predictive Modeling, Python, Predictive Modelling, Time Series, Recommendation Engine, Time Series Forecasting",https://www.naukri.com/job-listings-data-scientist-vipsa-talent-solutions-hyderabad-secunderabad-bangalore-bengaluru-5-to-8-years-281122005108
390,Data Scientist Urgent Position (Mumbai Location),Manek Consulting ,Multiple,"Machine learning tools R, Python and SAS is mustframework like Keras, Google Preferred ...",3-8 Yrs," Power Bi, SAS, Tableau, QlikView, Python, testing, PowerBI, Keras",https://www.naukri.com/job-listings-data-scientist-urgent-position-mumbai-location-manek-consulting-mumbai-mumbai-suburban-mumbai-all-areas-3-to-8-years-121021005040
391,Senior Analyst - Data Engineer,Dotdash Meredith,Bangalore,"Experience in ETL tasks like extracting data from multiple sources, join multiple table...",3-6 Yrs," Analyst, Database marketing, GIT, Linux, data science, Machine learning, Scheduling, Analytics",https://www.naukri.com/job-listings-senior-analyst-data-engineer-meredith-corporation-bangalore-bengaluru-3-to-6-years-210622500691
392,Data Engineering Trainee,Medtoureasy,Remote,Building Batch Data Pipelines on Google Cloud You will gain practical hands-on experien...,0-1 Yrs," data science, GCP, Machine learning, Cloud, Healthcare, healthcare analytics, big data, industrial training",https://www.naukri.com/job-listings-data-engineering-trainee-medtoureasy-remote-0-to-1-years-211122500263
393,Data (Ops) Engineer,Akaike Technologies,Hybrid,"A bachelors degree in data science and related disciplines like mathematics, statistics...",3-6 Yrs," Devops, Azure, Linux Scripting, Google Cloud architectures, Amazon Kinesis, Java, Kafka, Google Cloud",https://www.naukri.com/job-listings-data-ops-engineer-akaike-technologies-bangalore-bengaluru-3-to-6-years-021222006203
394,Data Engineer - Power BI,Tiger Analytics,Multiple,Adept understanding of any of the cloud services is preferred (Azure)5+ years of experi...,5-10 Yrs," Performance tuning, data science, Analytical, Consulting, power bi, Silicon, Data analytics, Unit testing",https://www.naukri.com/job-listings-data-engineer-power-bi-tiger-analytics-hyderabad-secunderabad-chennai-5-to-10-years-221022500687
395,Data Analyst,Automotive Robotics India,Chennai,Data Science/Analytics Engineercollaborates with business and analytics leaders to gene...,0-1 Yrs," data science, SAS, Data management, Analytical, Quality systems, Predictive modeling, Data mining, Forecasting",https://www.naukri.com/job-listings-data-analyst-automotive-robotics-india-pvt-ltd-chennai-0-to-1-years-081022500099
396,Analyst/Associate - Statistics/Machine Learning/Predictive Modeling,Black Turtle,Bangalore,Analyst / Associate - Statistics / Machine Learning / Predictive Modeling - BFSI - IIM ...,0-3 Yrs," Machine Learning, matlab, c++, python, r, data science, predictive modeling, portfolio management",https://www.naukri.com/job-listings-analyst-associate-statistics-machine-learning-predictive-modeling-black-turtle-india-pvt-ltd-bangalore-bengaluru-0-to-3-years-021222908538
397,Data Analyst,Commeasure Solutions India,Remote,"Bachelors / Masters degree in a field related to engineering, data science / analytics ...",0-2 Yrs," Excel, Data Warehousing, Python, ETL, SQL, R, IT Skills, Testing",https://www.naukri.com/job-listings-data-analyst-commeasure-solutions-india-pvt-ltd-remote-0-to-2-years-151122500838
398,Data Scientist Intern Rigbot,rigbot.com,Not Specified,Data Scientist Intern Rigbot Data Scientist Intern,0-1 Yrs," Data Science, python, R, Hadeep, Machine Learning, SQL",https://www.naukri.com/job-listings-data-scientist-intern-rigbot-rigbot-com-not-specified-0-to-1-years-081117500277
399,Data Analytics Intern,Reliance Games,Pune,Responsibilities Develops hypotheses and tests them by analyzing game data to draw insi...,0-1 Yrs," MS SQL, Data analysis, data science, MySQL, Conceptualization, Predictive modeling, DBMS, Oracle",https://www.naukri.com/job-listings-data-analytics-intern-reliance-games-pune-0-to-1-years-170622500701
400,Sr. Data Scientist - 1,Dunzo,Bangalore,Design and build reliable and scalable Data Science models. Work closely with stakehold...,5-8 Yrs," Computer vision, deep learning, data science, Machine learning, Deployment, Scientist 1, Management, Research",https://www.naukri.com/job-listings-sr-data-scientist-1-dunzo-bangalore-bengaluru-5-to-8-years-040822501788
401,Senior Manager/Assistant Vice President - Business Analyst - Insurance,Consult ShekharPandey,Multiple,"Facilitate and lead various stakeholder requirement discussion & walkthrough sessions, ...",7-10 Yrs," Operations, Data Science, system testing, Customer service, Data Analytics, Analytics, Business Analysis, Wireframes",https://www.naukri.com/job-listings-senior-manager-assistant-vice-president-business-analyst-insurance-consult-shekharpandey-mumbai-pune-7-to-10-years-281122906797
402,Data Scientist - Supply Chain,Cargill,Bangalore,Continuously seek out best practices and develop skills. Work on multidisciplinary team...,4-7 Yrs," Supply chain, continuous integration, Data analysis, data science, Machine learning, Workflow, Monitoring, SQL",https://www.naukri.com/job-listings-data-scientist-supply-chain-cargill-india-pvt-ltd-bangalore-bengaluru-4-to-7-years-240922500097
403,Assoc Mgr-Data Analytics,Sutherland Global Services Inc,Bangalore,Must have strong experience in Predictive Modeling using R AND Python along with strong...,2-6 Yrs," Predictive Modeling, SQL, Python, IT Skills, Data Science, Machine Learning, Mining, MIS",https://www.naukri.com/job-listings-assoc-mgr-data-analytics-sutherland-global-services-inc-bangalore-bengaluru-2-to-6-years-210722500335
404,Data Scientist,Infosys,Bangalore,"Industry knowledge- Knows basic principles of industry lexicon, competitor landscape, s...",3-6 Yrs," Data Science, IT Skills, Python, SAS, SPSS, SQL, algorithm",https://www.naukri.com/job-listings-data-scientist-infosys-limited-bangalore-bengaluru-3-to-6-years-091122911588
405,ACN - Applied Intelligence - Data Scientist - 09,Accenture,Bangalore,"Solid knowledge of and experience in Python, including related data science libraries a...",2-6 Yrs," Computer science, Automation, Machine learning, Monitoring, Python, learning, IT Skills, Data Science",https://www.naukri.com/job-listings-acn-applied-intelligence-data-scientist-09-accenture-solutions-pvt-ltd-bangalore-bengaluru-2-to-6-years-031122907306
406,Data Scientist - 2,24 7 ai,Bangalore,"Good to have exposure to conversational AI, AI-based question-answering systems, AI-bas...",4-8 Yrs," learning, Python, TensorFlow Extended, Natural Language, C, Azure, AI, communication",https://www.naukri.com/job-listings-data-scientist-2-24-7-customer-private-ltd-bangalore-bengaluru-4-to-8-years-021122501258
407,Data Scientist - Looking For Immediate Joiners,Wipro,Multiple,PhD / Masters in Computer Science / Statistics / Economics / Operations Research 5+ yea...,5-10 Yrs," Data Science, Predictive Modeling, Recommendation Engine, Time Series, Python, Predictive Analysis, SAS, analytical",https://www.naukri.com/job-listings-data-scientist-looking-for-immediate-joiners-wipro-limited-hyderabad-secunderabad-bangalore-bengaluru-5-to-10-years-011122013529
408,Data Scientist,Applied Materials,Bangalore,Good knowledge in statistics and math in deep understanding on ML algorithms and their ...,4-7 Yrs," deep learning, data science, Machine learning, Cloud, Data collection, Programming, big data, AWS",https://www.naukri.com/job-listings-data-scientist-applied-materials-india-private-limited-bangalore-bengaluru-4-to-7-years-311022501616
409,FTE - Regional BI - Data Scientist,Schneider Electric,Bangalore,"Knowledge of Big Data AWS technologies (S3, RedShift) is preferredExperience in providi...",3-5 Yrs," Computer science, SAP, data science, Oracle SQL, Neural networks, Machine learning, Business solutions, big data",https://www.naukri.com/job-listings-fte-regional-bi-data-scientist-schneider-electric-india-pvt-ltd-bangalore-bengaluru-3-to-5-years-290422501874
410,Big data Manager,Seven Consultancy (HR Solution),Bangalore,"Hands-on experience with the Hadoop stack HDFS, sqoop, kafka, Pulsar, NiFi, Spark, Spar...",4-8 Yrs," data services, data science, data security, big data analytics, cassandra, Consulting, Hadoop, Programming",https://www.naukri.com/job-listings-big-data-manager-seven-consultancy-hr-solution-bangalore-bengaluru-4-to-8-years-290322500325
411,Data Analytics Manager,Seven Consultancy (HR Solution),Bangalore,JOB DETAILS 1.Lead and develop a team of Data Analysts. 2.Build and maintain relationsh...,4-8 Yrs," Executive leadership, Data analysis, data science, big data analytics, Process improvement, Data collection, Consultancy, microsoft",https://www.naukri.com/job-listings-data-analytics-manager-seven-consultancy-hr-solution-bangalore-bengaluru-4-to-8-years-290322500315
412,Data Analytics - Credit Bureau Data,Seeburger,Multiple,Proficient in coding using SAS OR Python Strong banking domain knowledge - Loans / Cred...,3-5 Yrs," Loans, Computer vision, deep learning, data science, SAS, Coding, Analytical, Machine learning",https://www.naukri.com/job-listings-data-analytics-credit-bureau-data-seeburger-india-private-limited-mumbai-pune-bangalore-bengaluru-3-to-5-years-080822500453
413,Associate Manager MLOps - Data Bricks,Tredence,Bangalore,"Project Management: team leading experience of at least 5 years, client interaction and...",5-7 Yrs," Data management, data science, GCP, Project management, Analytical, Artificial Intelligence, Machine learning, Data analytics",https://www.naukri.com/job-listings-associate-manager-mlops-data-bricks-tredence-analytics-solutions-private-limited-bangalore-bengaluru-5-to-7-years-121022500842
414,Data Analyst/Data Scientist- Automotive Domain,Verolt Engineering,Multiple,Role Description Role: Data ScientistDepartment: Automotive software Education : Gradua...,3-6 Yrs," data analysis, IT Skills, Python, Data Science, Machine Learning, Artificial Intelligence, Cloud, Big Data",https://www.naukri.com/job-listings-data-analyst-data-scientist-automotive-domain-verolt-engineering-private-limited-hyderabad-secunderabad-pune-bangalore-bengaluru-3-to-6-years-151122009566
415,Data Scientist-Lead Data Analyst,Adecco India Private Limited   ,Hyderabad,Timing: Rotational Shift (WFO) Strong experience collaborating with non-data stakeholde...,5-9 Yrs," python, data science, Tableau, SQL, Looker, advanced analytics",https://www.naukri.com/job-listings-data-scientist-lead-data-analyst-adecco-india-private-limited-hyderabad-secunderabad-5-to-9-years-081122011256
416,Business Analyst - Data and Analytics,Schneider Electric,Bangalore,SQL knowledge - good to have Data analytics knowledge - good to have Good communication...,2-5 Yrs," SIDE, Business Analyst, Design review, Time management, Analytical, Data analytics, Oracle, SQL",https://www.naukri.com/job-listings-business-analyst-data-and-analytics-schneider-electric-india-pvt-ltd-bangalore-bengaluru-2-to-5-years-021222501183
417,Senior Statistician Big data,Seven Consultancy (HR Solution),Hyderabad,"Must have exposure in Time Series, Python-Flask and deployment skills of deploying deve...",5-10 Yrs," Computer science, deep learning, data science, big data analytics, Machine learning, API Testing, power bi, Database Administrator",https://www.naukri.com/job-listings-senior-statistician-big-data-seven-consultancy-hr-solution-hyderabad-secunderabad-5-to-10-years-290322500329
418,Data Governance Lead - Sr. Manager Level,Talent Et Au-dela,Pune,Joining a rapidly growing organization with an environment that fosters personal and pr...,12-16 Yrs," data science, Project management, Analytical, data governance, Manager Technology, Healthcare, Data quality, Data analytics",https://www.naukri.com/job-listings-data-governance-lead-sr-manager-level-talent-et-au-dela-pune-12-to-16-years-021122501976
419,Data Scientist,Fundnel,Mumbai,"Bachelor or Masters in Computer Science, Statistics, Mathematics, Economics, or any oth...",3-5 Yrs," Mining, Logistic regression, Financial statements, data science, Data modeling, Machine learning, Data mining, Monitoring",https://www.naukri.com/job-listings-data-scientist-fundnel-limited-mumbai-3-to-5-years-291122502863
420,Data Scientist,Reed Elsevier India (a Part Of Relx India,Multiple,Have a Bachelors education with two to five years of experience,2-5 Yrs," Health insurance, data science, Coding, Machine learning, Manager Technology, Healthcare, Open source, Analytics",https://www.naukri.com/job-listings-data-scientist-reed-elsevier-india-a-part-of-relx-india-pvt-ltd-chennai-bangalore-bengaluru-2-to-5-years-211122501103
421,Lead Data Scientist - Predictive Modeling,TransOrg Analytics,Multiple,"Bachelors in Computer Science, Engineering, Statistics, Maths or related quantitative d...",4-9 Yrs," Predictive Modeling, Data Science, Data Scientist, Data Management, Data Mining, Python, SQL",https://www.naukri.com/job-listings-lead-data-scientist-predictive-modeling-transorg-analytics-gurgaon-gurugram-delhi-ncr-4-to-9-years-261122907470
422,Data Scientist,Prithvi Technologies,Temp. WFH,Ability to perform data cleansing and work with technical and non-technical stakeholder...,8-13 Yrs," Data Science, algorithm development, machine learning, statistical programming, artificial intelligence, deep learning, python, linear regression",https://www.naukri.com/job-listings-data-scientist-prithvi-technologies-pune-8-to-13-years-181022007755
423,Data scientist,Tata AIA Life Insurance,Mumbai,Must Have - Master s Degree in Statistics/ Engineering and / or full-time specific cour...,8-13 Yrs," data science, advanced analytics, algorithms, statistical analytics, data visualization, statistics",https://www.naukri.com/job-listings-data-scientist-tata-aia-life-insurance-company-ltd-mumbai-8-to-13-years-291122915758
424,Data Scientist - Artificial Intelligence/Machine Learning,Ushyaku Software Solutions,Gurgaon,"Masters- degree in operations research, applied statistics, data mining, machine learni...",2-4 Yrs," Artificial Intelligence, Machine Learning, Alteryx, PythonSQL, troubleshooting, R, analytical, Python",https://www.naukri.com/job-listings-data-scientist-artificial-intelligence-machine-learning-ushyaku-software-solutions-gurgaon-gurugram-2-to-4-years-281122907026
425,Data Scientist,Wolters Kluwer,Multiple,"Dive deep into data, doing analysis, and discovering patterns/root causes. Generate ins...",3-5 Yrs," Training, Compliance, data science, VLOOKUP, Legal, Issue resolution, Data quality, Advanced Excel",https://www.naukri.com/job-listings-data-scientist-wolters-kluwer-financial-services-kalyani-pune-3-to-5-years-281122503351
426,Hiring For DATA Scientist @ NTT DATA Business Solution India,NTT DATA Business Solutions Private Limited,Multiple,"Dear All, We have urgent requirement for Data Science @ NTT DATA Business Solution.Noti...",4-9 Yrs," Data Science, Artificial Intelligence, Machine Learning, data factory, Databricks, C, Pytorch, CNTK",https://www.naukri.com/job-listings-hiring-for-data-scientist-ntt-data-business-solution-india-ntt-data-business-solutions-private-limited-noida-hyderabad-secunderabad-pune-gurgaon-gurugram-chennai-bangalore-bengaluru-mumbai-all-areas-4-to-9-years-221122913792
427,Data Scientist -II,SuccessR Hrtech Pvt Ltd,Temp. WFH,You should be passionate about working with data sets and be someone who loves to bring...,2-5 Yrs," Data Science, Pytorch, Tensorflow, NLP, No SQL, Machine Learning, Deep Learning, Python",https://www.naukri.com/job-listings-data-scientist-ii-successr-hrtech-pvt-ltd-bangalore-bengaluru-2-to-5-years-181122906300
428,ML / Data Scientist,Gibots,Pune,The candidate should have a Bachelor s Degree 2 years of experience in ML / Data Scienc...,0-2 Yrs," analysis, PyTorch, analytical, ML, software architecture, Data Science, communication, Python",https://www.naukri.com/job-listings-ml-data-scientist-gibots-pune-0-to-2-years-181022501324
429,Data Scientist,Multi Recruit,Bangalore,2+ years experience in data science and consultingGood to have: - Experience in the Hea...,1-4 Yrs," Data Science, Pyspark, Customer Segmentation, Python, SQL, Agile way, data scraping, PowerPoint",https://www.naukri.com/job-listings-data-scientist-multi-recruit-bangalore-bengaluru-1-to-4-years-211122012427
430,Principal Data Scientist,Novartis,Hyderabad,"Experience with good data science practices (version control, unit testing, CI / CD, et...",7-11 Yrs," Data analysis, Automation, data science, Machine learning, Clinical trials, clinical development, Application development, Operations",https://www.naukri.com/job-listings-principal-data-scientist-novartis-healthcare-pvt-ltd-hyderabad-secunderabad-7-to-11-years-171122502059
431,Data Analyst,Cargill,Bangalore,Bachelor s degree in a related field or equivalent experience Other minimum qualificati...,3-5 Yrs," database design development, data analysis, data analytics, data mining, data segmentation, Data Analyst",https://www.naukri.com/job-listings-data-analyst-cargill-india-pvt-ltd-bangalore-bengaluru-3-to-5-years-291122915078
432,Data Analyst,Cargill,Bangalore,Bachelors degree in a related field or equivalent experience Proficiency with reporting...,2-4 Yrs," database design, data analytics, SAP, Data management, Power BI, Alteryx, data visualization, Tableau",https://www.naukri.com/job-listings-data-analyst-cargill-india-pvt-ltd-bangalore-bengaluru-2-to-4-years-291122914429
433,Data Analyst,Cointab Software,Multiple,Job Description-We are a rapidly growing SaaS Software Company looking for a Data Analy...,0-2 Yrs," data analysis, Python, Financial Reporting, Financial Research, VLOOKUP, Node.Js, Advanced Excel, Data Analytics",https://www.naukri.com/job-listings-data-analyst-cointab-software-private-limited-mumbai-suburban-mumbai-all-areas-0-to-2-years-071122001529
434,Analyst - Data Intelligence Group,TresVista Financial,Multiple,Preferably for tier 1 engineering college Experience in the analytics domain will be an...,0-1 Yrs," Computer science, Industry research, Fund administration, power bi, Data analytics, DBMS, QlikView, Operations",https://www.naukri.com/job-listings-analyst-data-intelligence-group-tresvista-financial-mumbai-pune-bangalore-bengaluru-0-to-1-years-070222501472
435,Senior Data Scientist,Maruti Techlabs Pvt Ltd,Ahmedabad,"Good to have knowledge of MLOps pipelines working to support development, experimentati...",4-9 Yrs," Data Scientist, Artificial Intelligence, Natural Language Processing, Ml Algorithms, Machine Learning, Deep Learning, R, data science",https://www.naukri.com/job-listings-senior-data-scientist-maruti-techlabs-pvt-ltd-ahmedabad-4-to-9-years-221122014411
436,Senior Data Scientist - R/Python,MNR Solutions Private Limited,Dubai,Experience in using cloud data platform solutions (ie Experience in building & deploy l...,5-7 Yrs," Python, data science, Snowflake, cloud data, R, Google Big Query, Data Bricks, SQL",https://www.naukri.com/job-listings-senior-data-scientist-r-python-mnr-solutions-private-limited-dubai-5-to-7-years-211122907507
437,Analyst - Data Engineer,Dotdash Meredith,Bangalore,"Experience in ETL tasks like extracting data from multiple sources, join multiple table...",1-2 Yrs," Analyst, Database marketing, GIT, Linux, data science, Machine learning, Scheduling, Analytics",https://www.naukri.com/job-listings-analyst-data-engineer-meredith-corporation-bangalore-bengaluru-1-to-2-years-210622500690
438,Senior Data Scientist,Intelligent Image Management,Kolkata,Minimum 5+ years experience with big data technologies and machine learningStrong profi...,5-8 Yrs," data scientist, python, R, node.js, data science, AI, Research, Tableau",https://www.naukri.com/job-listings-senior-data-scientist-intelligent-image-management-kolkata-5-to-8-years-241122005787
439,Senior Data Analyst,Malabar Group,Mumbai,"Strong Values: Adhere to ethical practices, earn trust and build strong relationships Q...",6-8 Yrs," Data Management, data analysis, market research, Data Analytics, business tools",https://www.naukri.com/job-listings-senior-data-analyst-malabar-group-mumbai-all-areas-6-to-8-years-281122005554
440,Data Analytics Manager,Seven Consultancy (HR Solution),Mumbai,JOB DETAILS 1.Lead and develop a team of Data Analysts. 2.Build and maintain relationsh...,4-6 Yrs," Executive leadership, Data analysis, data science, big data analytics, Process improvement, Data collection, Consultancy, microsoft",https://www.naukri.com/job-listings-data-analytics-manager-seven-consultancy-hr-solution-mumbai-4-to-6-years-290322500312
441,Statistician- Big Data,Seven Consultancy (HR Solution),Hyderabad,"Must have exposure in Time Series, Python-Flask and deployment skills of deploying deve...",3-5 Yrs," Computer science, deep learning, data science, big data analytics, Machine learning, API Testing, power bi, Database Administrator",https://www.naukri.com/job-listings-statistician-big-data-seven-consultancy-hr-solution-hyderabad-secunderabad-3-to-5-years-280322502304
