,Job Title,Company,Location,Requirements,Years of Experience,Tags,Link
249,Lead Data Science - Andheri - immediate Joiners,Talent  Corner HR Services Pvt Ltd,Multiple,More than 5 years experience in working on data problems and 3+ years in credit risk m...,4-9 Yrs," Ultrix, R, credit risk modeling, Statistical modeling, Python, Data Science, NLP, Research Development",https://www.naukri.com/job-listings-lead-data-science-andheri-immediate-joiners-talent-corner-hr-services-pvt-ltd-mumbai-mumbai-suburban-4-to-9-years-101122005533
250,Data Scientist,Godrej Agrovet Ltd,Mumbai,"BTech or Bachelor s degree in mathematics, statistics or computer science or related qu...",0-2 Yrs," Supply chain, Computer science, Data analysis, Business transformation, data science, Cloud, Agile, Predictive modeling",https://www.naukri.com/job-listings-data-scientist-godrej-agrovet-ltd-mumbai-0-to-2-years-301122500151
251,Data Scientist - BFSI,Huquo Consulting Pvt. Ltd,Multiple,Btech / Masters from top tier insitute / university with excellent academic recordExper...,3-8 Yrs," SQL, Data Science, NLP, Data Scientist, Data Management, Statistical Modeling, data visualisation tools, Data Analytics",https://www.naukri.com/job-listings-data-scientist-bfsi-huquo-consulting-pvt-ltd-gurgaon-gurugram-delhi-ncr-3-to-8-years-291122915900
252,Data Scientist-  Bangalore/ Pune Hybrid,Team Plus Staffing Solution Pvt Ltd  ,Multiple,"Python, ML, DL, APIs, Big Data Tools",3-8 Yrs," Data Scientist, Machine Learning, Python, ML, APIs, Big Data, DL, IT Skills",https://www.naukri.com/job-listings-data-scientist-bangalore-pune-hybrid-team-plus-staffing-solution-pvt-ltd-pune-bangalore-bengaluru-delhi-ncr-3-to-8-years-091122010281
253,Assistant Manager - Data Scientist - Risk Surveillance - Model Tuning,Phenom placement,Gurgaon,"Experience with Project management, handling multi-initiatives with limited resource an...",6-9 Yrs," Power BI, Data Science, Business Intelligence, NLP, Data Scientist, Big Data, Data Modeling, Data Analytics",https://www.naukri.com/job-listings-assistant-manager-data-scientist-risk-surveillance-model-tuning-phenom-placement-gurgaon-gurugram-6-to-9-years-291122913902
254,Lead Data Scientist,DAP Consultancy Services,Multiple,A post graduate degree in data science-related fields andor an MBA Professional experie...,10-14 Yrs," Data Science, Data Management, Data Analytics",https://www.naukri.com/job-listings-lead-data-scientist-dap-consultancy-services-mumbai-bangalore-bengaluru-10-to-14-years-181122907603
255,Data Scientist,Third Eye Data Analytics Services India Private Li,Permanent Remote,*****Need Immediate Joiner Only*****Roles and Responsibilities Main Skills: Data Mining...,5-10 Yrs," deep learning, python, Natural Language Processing, regression analysis, linear regression, Multivariate Analysis, data science, neural networks",https://www.naukri.com/job-listings-data-scientist-third-eye-data-analytics-services-india-private-li-bangalore-bengaluru-5-to-10-years-231122007610
256,EY hiring- Consultant Data analysis,EY,Kolkata,BTech / BE/MSc / MCA/M.COM /MBA/ MTech with background of mathematics/ Statistics / Eco...,3-7 Yrs," data analysis, data science, Data Analytics",https://www.naukri.com/job-listings-ey-hiring-consultant-data-analysis-ernst-and-young-services-pvt-ltd-kolkata-3-to-7-years-011122016087
257,Data Scientist Lead (Bangalore) For Life Sciences company,LYKORA CONSULTING SERVICES PRIVATE LIMITED ,Bangalore,"Develop data science solutions across life sciences including analytical offerings, emb...",3-8 Yrs," Data Science, Artificial Intelligence, data scientist, Machine Learning",https://www.naukri.com/job-listings-data-scientist-lead-bangalore-for-life-sciences-company-lykora-consulting-services-private-limited-bangalore-bengaluru-3-to-8-years-111122005288
258,Data Scientist Consultant,M/S Aarons Visions,Multiple,We are looking for a data scientist who analyzes large amounts of raw information to fi...,6-11 Yrs," Data Science, Data Structures, Big Data, Data Quality, Data Management, Data Analysis, Data Extraction, Data Maintenance",https://www.naukri.com/job-listings-data-scientist-consultant-m-s-aarons-visions-germany-hong-kong-united-kingdom-uk-6-to-11-years-271122001064
259,Data Scientist Consultant,M/S Aarons Visions,Multiple,We are looking for a data scientist who analyzes large amounts of raw information to fi...,6-11 Yrs," Data Science, Data Structures, Big Data, Data Quality, Data Management, Data Analysis, Data Extraction, Data Maintenance",https://www.naukri.com/job-listings-data-scientist-consultant-m-s-aarons-visions-australia-singapore-canada-6-to-11-years-261122007242
260,Data Engineer,Ikonsult,Permanent Remote,"Essential Technical Skills: Technical expertise with emerging Big Data technologies, su...",3-8 Yrs," data modeling, python, data analytics, data science, spark, hadoop, big data",https://www.naukri.com/job-listings-data-engineer-ikonsult-gurgaon-gurugram-3-to-8-years-301122004960
261,AWS Data Engineer- Remote,Holcim,Permanent Remote,"Experience : 3- 5YearsJob Location : Airoli, Navi MumbaiJob Description as follows:The ...",2-5 Yrs," Solution Architecture, Data Science, Pyspark, Data Engineering, Project Management, Agile, Aws Glue, Data Analytics",https://www.naukri.com/job-listings-aws-data-engineer-remote-holcim-mumbai-all-areas-2-to-5-years-160122001456
262,Analyst - Data Scientist,UPL Limited,Mumbai,2 + years experience with popular database programming in relational and nonrelational ...,2-3 Yrs," advanced analytics, Scala, PySpark, Hadoop, Machine Learning, SQL, deep learning, NLP",https://www.naukri.com/job-listings-analyst-data-scientist-upl-limited-mumbai-2-to-3-years-221122912682
263,Data Analyst - Python / Artificial Intelligence,iMindYourBusiness,Multiple,Candidates must have ability to work from home and also in a position to use their pers...,0-2 Yrs," Python, SQL server, VBA, Advanced Excel, C++, IT Skills, Data Science, Artificial Intelligence",https://www.naukri.com/job-listings-data-analyst-python-artificial-intelligence-imindyourbusiness-kolkata-mumbai-hyderabad-secunderabad-lucknow-chennai-ahmedabad-delhi-ncr-bangalore-bengaluru-0-to-2-years-211122908877
264,Senior Data Analyst,Seven Consultancy (HR Solution),Bangalore,Assist the data scientist in development of new analytical tools and methods as and whe...,5-10 Yrs," Procurement, data science, big data analytics, Analytical, Data collection, big data analyst, Consultancy, Data Analyst",https://www.naukri.com/job-listings-senior-data-analyst-seven-consultancy-hr-solution-bangalore-bengaluru-5-to-10-years-280322501565
265,Data Analyst / Sr Data Analyst - FIntech,Connexions,Bangalore,"About the role As a Data Analyst, you will help shape credit, business, and collections...",1-4 Yrs," Python coding, python, Business Analytics, credit risk analytics, Data Science modeling, Data Analytics",https://www.naukri.com/job-listings-data-analyst-sr-data-analyst-fintech-connexions-bangalore-bengaluru-1-to-4-years-141122911648
266,Web Analytics Data Insights Analyst / Sr. Analyst,Absolutdata,New Delhi,"We are looking for a dynamic, detail oriented and versatile Web Analyst with strong bus...",4-8 Yrs," Data Science, Statistical Modeling, Data Mining, Data Visualization, Web Analytics, Tableau, Machine Learning, Adobe Analytics",https://www.naukri.com/job-listings-web-analytics-data-insights-analyst-sr-analyst-absolutdata-research-analytics-solutions-pvt-lt-new-delhi-4-to-8-years-301121500628
267,Data Scientist,Boston Consulting Group,Bangalore,Previous experience working in a global organization or professional services firm is p...,3-6 Yrs," Front end, data science, Agile, Data processing, Workflow, data visualization, Business intelligence, Analytics",https://www.naukri.com/job-listings-data-scientist-boston-consulting-group-bangalore-bengaluru-3-to-6-years-251122502740
268,Data Analysis and Data Visualization Application Developer,Alegra Labs,Guwahati,Candidate should be experienced in Regular Expressions (Parsers and Crawlers) - profici...,3-6 Yrs," Machine learning, Firebase, Keras, Data Wrangling, D3 js, Google Colab, Pandas, CSS3",https://www.naukri.com/job-listings-data-analysis-and-data-visualization-application-developer-alegra-labs-guwahati-3-to-6-years-111022501759
269,Sr Data Scientist | Gurgaon | WFO,Ofb Tech,Gurgaon,Experience using different machine learning related modules in Python (e.gMust have ver...,3-6 Yrs," Data Science, Data Science Engineer, Data Scientist, lightgmb, sklearn, xgboost, Machine Learning, Deep Learning",https://www.naukri.com/job-listings-sr-data-scientist-gurgaon-wfo-ofb-tech-pvt-ltd-gurgaon-gurugram-3-to-6-years-191022611908
270,Analyst OR Sr Analyst (Data Scientist),Novartis,Hybrid,"Good To have experience: in any BI Tool( Power BI, Qlik sense, etcDomain Good to have: ...",2-5 Yrs," python, data science, predictive analytics, feature engineering, statistical modeling, prescriptive analytics, Cognitive analytics",https://www.naukri.com/job-listings-analyst-or-sr-analyst-data-scientist-novartis-hyderabad-secunderabad-2-to-5-years-251122004422
271,Data Scientist III,Groupon,Bangalore,The Data Science team at Groupon owns the heart of our decision-making system that prov...,6-10 Yrs," Data science, deep learning, python, Hive, data analysis, GCP, data mining, Hadoop",https://www.naukri.com/job-listings-data-scientist-iii-groupon-shared-services-pvt-ltd-bangalore-bengaluru-6-to-10-years-301122909365
272,Data Analyst,Cheil India,Gurgaon,Experience- 6 months to 2 Years (Freshers can also apply)Must have:- Good hands on expe...,0-2 Yrs," Data Science, Excel, Statistics, Analytics, Python, Machine Learning",https://www.naukri.com/job-listings-data-analyst-cheil-india-pvt-ltd-gurgaon-gurugram-0-to-2-years-021122012139
273,Intern- BPI (LSS & Data Analytics),Sgtc India,Gurgaon,"Engage in activities related to Data mining, Interpretation, Analysis, and Report gener...",2-7 Yrs," MS Access, data science, Database management, Analytical, Debugging, Computer application, Data analytics, Data mining",https://www.naukri.com/job-listings-intern-bpi-lss-data-analytics-sgtc-india-gurgaon-gurugram-2-to-7-years-181122500042
274,Assistant Manager/Manager/Senior Manager - Data Scientist,Huquo Consulting Pvt. Ltd,Multiple,Very strong analytical skills with the demonstrated ability to research and make decisi...,2-7 Yrs," Data Science, SAS, Machine Learning, Statistics, Analytics, Scikit - Learn, Spark NLP, NLP",https://www.naukri.com/job-listings-assistant-manager-manager-senior-manager-data-scientist-huquo-consulting-pvt-ltd-gurgaon-gurugram-bangalore-bengaluru-2-to-7-years-301122906739
275,Data Scientist/ Sr. Data Scientist/ Principal Data Scientist,BigShyft.com,Bangalore,Experience working with and creating data architecturesExperience using statistical com...,4-9 Yrs," python, data science, spark, machine learning, ad-tech, r, search ads, Adtech",https://www.naukri.com/job-listings-data-scientist-sr-data-scientist-principal-data-scientist-bigshyft-com-bangalore-bengaluru-4-to-9-years-080922003980
276,Sr. Machine Learning Data Scientist,WINNING EDGE,Bangalore,"Basic Qualifications: Masters in Statistics, Economics, Operations Research, Data Scien...",7-12 Yrs," Machine Learning, Data Science, R, DNN, Data visualization, Deep Learning, SQL, Python",https://www.naukri.com/job-listings-sr-machine-learning-data-scientist-edge-bangalore-bengaluru-7-to-12-years-021222910164
277,Senior Data Scientist AI Initiative,Lendingkart,Bangalore,"As a Senior data scientist, you will work in the AI Initiatives section of Data Science...",5-10 Yrs, data science,https://www.naukri.com/job-listings-senior-data-scientist-ai-initiative-lendingkart-finance-limited-bangalore-bengaluru-5-to-10-years-021222501422
278,Data Scientist and Senior Data Scientist,3i Infotech,Chennai,Experience in data mining Proven experience as a Data Scientist or Data Analyst Experie...,5-10 Yrs," Data Science, Data Scientist, Python, bigdata frameworks, Tableau, presentation, Hadoop, Power BI",https://www.naukri.com/job-listings-data-scientist-and-senior-data-scientist-3i-infotech-limited-chennai-5-to-10-years-021122605367
279,Assistant Manager/Senior Manager - Data Scientist - IT,Huquo Consulting Pvt. Ltd,Multiple,Very strong analytical skills with the demonstrated ability to research and make decisi...,2-7 Yrs," Data Science, Data Scientist, SAS, Data Management, Statistical Modeling, Data Visualization, Data Analytics, Statistics",https://www.naukri.com/job-listings-assistant-manager-senior-manager-data-scientist-it-huquo-consulting-pvt-ltd-gurgaon-gurugram-bangalore-bengaluru-2-to-7-years-091122913520
280,Sr.Data Scientist (AI\ML),Varite,Bangalore,Designing ML systems Researching and implementing ML algorithms and models as per Desig...,4-9 Yrs," Statistical analysis, data science, Machine learning, Packaging, Data quality, Data analytics, Research, Python",https://www.naukri.com/job-listings-sr-data-scientist-ai-ml-varite-bangalore-bengaluru-4-to-9-years-081022500495
281,Job Opportunity For Data Scientists |TIBCO Software,TIBCO,Pune,Tibco is hiring for Data-Scientist role!Required Experience: 3-4 yearsEducation: Should...,2-5 Yrs," written, big data, oral communication, Bot framework, machine learning, SparkR, cloud technologies, Azure",https://www.naukri.com/job-listings-opportunity-for-data-scientists-tibco-software-tibco-pune-2-to-5-years-021222009164
282,Lead Data Scientist,Cotiviti,Multiple,Must have implemented machine learning solutions within production environments at scal...,5-8 Yrs," tensorflow, deep learning, python, nlp, GIT, data science, health insurance, Artificial Intelligence",https://www.naukri.com/job-listings-lead-data-scientist-cotiviti-hyderabad-secunderabad-pune-coimbatore-5-to-8-years-011222005982
283,Data Scientist,Cotiviti,Multiple,Must have implemented machine learning solutions within production environments at scal...,3-5 Yrs," tensorflow, financial analysis, python, health insurance, Hadoop, Bigdata, US Healthcare, machine learning",https://www.naukri.com/job-listings-data-scientist-cotiviti-hyderabad-secunderabad-pune-coimbatore-3-to-5-years-011222005780
284,Data Scientist,Thomson Digital,Noida,You will ideally have extensive experience building analytics products from a technolog...,3-8 Yrs," data science, Java, python, Hibernate, transformers, supervised learning, J2Ee, data structures",https://www.naukri.com/job-listings-data-scientist-thomson-digital-noida-3-to-8-years-021222007103
285,Data Engineer,Seven Consultancy (HR Solution),Bangalore,"Hands-on experience with the Hadoop stack HDFS, sqoop, kafka, Pulsar, NiFi, Spark, Spar...",3-8 Yrs," data services, data science, data security, big data analytics, cassandra, Consulting, Hadoop, Programming",https://www.naukri.com/job-listings-data-engineer-seven-consultancy-hr-solution-bangalore-bengaluru-3-to-8-years-171122500726
286,Data Analyst,What Digital Technologies Private Limited  ,Bangalore,Good understanding of statistics and analysis techniques (parametric & nonparametric mo...,4-8 Yrs," Data Studio, google analytics, Data Analytics, IT Skills, Java, Python, Data Science, Tableau",https://www.naukri.com/job-listings-data-analyst-what-digital-technologies-private-limited-bangalore-bengaluru-4-to-8-years-151122007595
287,Data Analyst Trainee,Medtoureasy,Remote,"This Program does not require any prior programming or statistical skills, and is suita...",0-1 Yrs," Data analysis, PDF, data science, Cognos, Analytical, Healthcare, Data Analyst, data visualization",https://www.naukri.com/job-listings-data-analyst-trainee-medtoureasy-remote-0-to-1-years-211122500261
288,Data Analyst - FinTech,Upshoot HR Solutions Pvt. Ltd.,Bangalore,"Strong business judgment, leadership and integrity: She / he should be a tenacious prob...",1-4 Yrs," Data Analytics, Data Science, Predictive Modeling, Data Mining, Python Coding, Analytics, Segmentation Modeling, Python",https://www.naukri.com/job-listings-data-analyst-fintech-upshoot-hr-solutions-pvt-ltd-bangalore-bengaluru-1-to-4-years-041122912075
289,Data Analyst,Seven Consultancy (HR Solution),Bangalore,Assist the data scientist in development of new analytical tools and methods as and whe...,2-3 Yrs," Procurement, data science, big data analytics, Analytical, Consulting, Data collection, big data analyst, Consultancy",https://www.naukri.com/job-listings-data-analyst-seven-consultancy-hr-solution-bangalore-bengaluru-2-to-3-years-280322501314
290,Data Analyst,Talent Zone Consultant,Bangalore,graduate degree in Data Science or other quantitative field is preferred Experience in ...,10-12 Yrs," Data Science, Business Intelligence, R, Data Scientist, C + +, Hadoop, Data Analysis, Data Mining",https://www.naukri.com/job-listings-data-analyst-talent-zone-consultant-bangalore-bengaluru-10-to-12-years-071021501340
291,Data Analyst,Klub,Bangalore,Minimum 1 year of working experience as a Data Analyst or Business Data Analyst Knowled...,1-4 Yrs," Data Science, Sas, Database Design Development, Business Data Analyst, Etl Frameworks, Data Mining, Process Improvement, Data Collection",https://www.naukri.com/job-listings-data-analyst-klub-bangalore-bengaluru-1-to-4-years-011021500845
292,Lead Data Analyst,Adecco India Private Limited   ,Hyderabad,"Roles and Responsibilities LEAD DATA ANALYST:In this role, youll lead a team which uses...",5-9 Yrs," python, Tableau, Data Analytics, Data Science, Leadership",https://www.naukri.com/job-listings-lead-data-analyst-adecco-india-private-limited-hyderabad-secunderabad-5-to-9-years-081122011892
293,Sr . Data Analyst - Business Insights,"Saavn, LLC",Mumbai,"Bachelor s or higher degree in Data Analytics, Data Science, Statistics, Math, Engineer...",2-5 Yrs," Data Science, R, Data Analysis, Data Visualization, Advanced Excel, Data Analyst, Data Analytics, Statistics",https://www.naukri.com/job-listings-sr-data-analyst-business-insights-saavn-llc-mumbai-2-to-5-years-071021500841
294,Head - Data Analytics - IT,Options Executive Search Private Limited.,Chennai,A minimum of 12-15 years of experience in Data Science driving B2B IT product/ services...,12-15 Yrs," Data Analytics, AIML Implementation, Java, Azure, SaaS, Big Data, B2B IT product, Machine Learning",https://www.naukri.com/job-listings-head-data-analytics-it-options-executive-search-private-limited-chennai-12-to-15-years-291122912581
295,"Manager - Data Analytics, Navi Mumbai",Utkarsh Small Finance Bank,Mumbai,"Proficiency in predictive modelling and Machine learning (Logistic / Linear regression,...",4-8 Yrs," data analytics, predictive modeling, Advanced Analytics, Data Science, python, Power Bi, machine learning",https://www.naukri.com/job-listings-manager-data-analytics-navi-mumbai-utkarsh-small-finance-bank-navi-mumbai-4-to-8-years-191122004508
296,Lead Data Scientist / ML engineer-- US MNC (analytics),Aspyra Hr Services,Multiple,"Has experience working on unstructured data ( text ): Text cleaning, TFIDF, text vector...",7-12 Yrs," python, Data Science, algorithms, predictive modeling, Natural Language Processing, Machine Learning Algorithms, knn, machine learning",https://www.naukri.com/job-listings-lead-data-scientist-ml-engineer-us-mnc-analytics-aspyra-hr-services-gurgaon-gurugram-bangalore-bengaluru-7-to-12-years-011222007063
297,Data Analyst,RyTe4u Solutions  ,Hybrid,- B.Tech from a Tier I / MBA from tier 1 institutes - Exp in Analytics / Data science v...,2-4 Yrs," Data Analytics, Data Science, SAS, Power Bi, Tableau, Python",https://www.naukri.com/job-listings-data-analyst-ryte4u-solutions-bangalore-bengaluru-2-to-4-years-011122004386
298,Machine Learning  Engineer / Python Developer / Data Scientist,Mark Consultancy Services,Hybrid,Machine Learning and Data Scientist: A minimum of 5 years of experience with 3 years re...,4-9 Yrs," python, machine learning, data science, reinforcement learning",https://www.naukri.com/job-listings-machine-learning-engineer-python-developer-data-scientist-mark-consultancy-services-bangalore-bengaluru-4-to-9-years-261122006674
299,Senior Analyst/ Data Scientist,Tiger Analytics,Multiple,2 years of must-have hands-on experience in SAS and Python is mandatoryExperience worki...,2-7 Yrs," Analyst, Statistical modeling, SAS, data science, risk modeling, Machine learning, big data, Financial services",https://www.naukri.com/job-listings-senior-analyst-data-scientist-tiger-analytics-hyderabad-secunderabad-chennai-bangalore-bengaluru-2-to-7-years-220922501686
300,Senior Data Research Analyst,Morningstar,Hybrid,"Participate in other data and process related projects, like industry / market data col...",0-3 Yrs," Data Analysis, Data Analytics, Market Forecasting, research analysis, Market Analysis",https://www.naukri.com/job-listings-senior-data-research-analyst-morningstar-india-p-ltd-mumbai-all-areas-0-to-3-years-021122005187
301,Urgent Job Opening of Lead Data Scientist / Data Scientist,Trellance,Multiple,"Job Type: Full TimeBE/ B Tech, MCA, MSc (Statistics), MBA from Recognized UniversityThe...",6-11 Yrs," python, data science, data mining, machine learning, sql server, r, data analytics, svm",https://www.naukri.com/job-listings-urgent-opening-of-lead-data-scientist-data-scientist-trellance-ahmedabad-bangalore-bengaluru-6-to-11-years-240322005713
302,"Data Scientist, II",Zebra Technologies,Bangalore,Interacts with product and service teams to identify questions and issues for data anal...,2-5 Yrs," Data Science, data analysis, Hadoop, Cassandra, Big Data, Data Mining, Spark",https://www.naukri.com/job-listings-data-scientist-ii-zebra-technologies-corporation-bangalore-bengaluru-2-to-5-years-021222904113
303,Data Scientist - KPO,Huquo Consulting Pvt. Ltd,Multiple,Should be able to work on a problem independently and prepare client ready deliverable ...,4-8 Yrs," Data Science, Data Management, Data Modeling, Python, SQL, Predictive Modeling, Machine Learning",https://www.naukri.com/job-listings-data-scientist-kpo-huquo-consulting-pvt-ltd-gurgaon-gurugram-bangalore-bengaluru-4-to-8-years-301122906669
304,Lead Data Scientist (Diversity Role),Emploi Consultancy,Bangalore,5+ years of experience as a Data Scientist,5-10 Yrs," Python, machine learning, SQL, Data Science",https://www.naukri.com/job-listings-lead-data-scientist-diversity-role-emploi-consultancy-bangalore-bengaluru-5-to-10-years-301122905714
305,Data Scientist - Analytics,Huquo Consulting Pvt. Ltd,Multiple,DATA SCIENTISTS - Understand data and different platforms used by client- Translate bus...,7-12 Yrs," Data Science, Predictive Modeling, Data Management, Data Analytics",https://www.naukri.com/job-listings-data-scientist-analytics-huquo-consulting-pvt-ltd-gurgaon-gurugram-bangalore-bengaluru-7-to-12-years-071122907839
306,Data Scientist - BFS,Huquo Consulting Pvt. Ltd,Multiple,"Bachelors / Masters degree in economics, mathematics, computer science / engineering, o...",4-9 Yrs," data analytics, Data Science, SAS, Data Scientist, Data Management, Statistics, Machine Learning, Analytics",https://www.naukri.com/job-listings-data-scientist-bfs-huquo-consulting-pvt-ltd-gurgaon-gurugram-bangalore-bengaluru-4-to-9-years-071122903435
307,Data Scientist,o9 Solutions,Bangalore,"Bachelors Degree in Computer Science, Mathematics, Statistics, Economics, Engineering o...",1-4 Yrs," Data Science, Time Series, Tensorflow, python, Arima, Deep Learning",https://www.naukri.com/job-listings-data-scientist-o9-solutions-bangalore-bengaluru-1-to-4-years-021222004422
308,Data Scientist-Product Based Company-Immediate Joiners,Pylon Management Consulting,Multiple,Preferred Location- BE / BTech comp science preferredVery good academic background3 to ...,3-8 Yrs," Data Science, deep learning, NLP, Natural Language Processing, machine learning, nosql, sql",https://www.naukri.com/job-listings-data-scientist-product-based-company-immediate-joiners-pylon-management-consulting-hyderabad-secunderabad-navi-mumbai-bangalore-bengaluru-mumbai-all-areas-3-to-8-years-011222006769
309,Data Scientist - Analytics,Huquo Consulting Pvt. Ltd,Multiple,DATA SCIENTISTS- Understand data and different platforms used by client- Translate busi...,7-12 Yrs," Data Science, Predictive Modeling, Data Scientist, Data Management, Statistical Modeling, Data Modeling, Data Analytics, Statistics",https://www.naukri.com/job-listings-data-scientist-analytics-huquo-consulting-pvt-ltd-gurgaon-gurugram-bangalore-bengaluru-7-to-12-years-011122908651
310,Data Scientist - Azure,Huquo Consulting Pvt. Ltd,Multiple,"Mandate skills : Data Scientist, Must have experience in building web applications with...",5-10 Yrs," Data Science, PySpark, Data Modeling, Data Analytics, Python, React, Predictive Modeling, Azure",https://www.naukri.com/job-listings-data-scientist-azure-huquo-consulting-pvt-ltd-gurgaon-gurugram-bangalore-bengaluru-5-to-10-years-141122907872
311,Data Scientist - Azure,Huquo Consulting Pvt. Ltd,Multiple,"Mandate skills : Data Scientist, Must have experience in building web applications with...",5-10 Yrs," Azure, Data Science, Analytics consulting, PySpark, Statistical Analyst, Data Modeling, Data Analytics, Regression Modeling",https://www.naukri.com/job-listings-data-scientist-azure-huquo-consulting-pvt-ltd-gurgaon-gurugram-bangalore-bengaluru-5-to-10-years-121122906273
312,Data Scientist,kk consulting services,Bangalore,Enable the power of data analytics in the medical/healthcare domain. Enable the power o...,2-5 Yrs," Mining, Business process, advanced analytics, customer analytics, Statistical analysis, data science, Machine learning, Healthcare",https://www.naukri.com/job-listings-data-scientist-kk-consulting-services-bangalore-bengaluru-2-to-5-years-100222500945
