,Job Title,Company,Location,Requirements,Years of Experience,Tags,Link
0,Senior Analyst-Data Science,Accenture,Gurgaon,Skill required: Data Science - Predictive Modeling and Analytics Designation: Senior An...,5-8 Yrs," Publishing, Consulting, Predictive modeling, Data mining, Analytics, IT Skills, Data Science, Machine Learning",https://www.naukri.com/job-listings-senior-analyst-data-science-accenture-solutions-pvt-ltd-gurgaon-gurugram-5-to-8-years-171122907232
1,Delivery Head - Analytics & Data Science,Okda Solutions,Gurgaon,"10+ years of experience in the delivery of Analytics, data science and machine learning...",8-13 Yrs," Data Science, Analytics, analytical, machine learning, communication, Sales, calling, analytical skills",https://www.naukri.com/job-listings-delivery-head-analytics-data-science-okda-solutions-gurgaon-gurugram-8-to-13-years-291122913252
2,Chief Data Science Role - Bank,Dimensions HRD Consultants,Multiple,Graduate / Post Graduate in Statistics / Economics / Engineering from premier college /...,12-16 Yrs," Data Modeling, Data Analytics, Analytics, Consulting - BFSI, Data Management, Big Data, Data Mining, Statistics",https://www.naukri.com/job-listings-chief-data-science-role-bank-dimensions-hrd-consultants-mumbai-gurgaon-gurugram-12-to-16-years-291122912158
3,Associate Vice President - Data Science - KPO,Huquo Consulting Pvt. Ltd,Gurgaon,Role & Responsibilities Overview :- Expected to work in close collaboration with the Cl...,7-12 Yrs," Data Science, Competitor analysis, Ad hoc data analysis, GLM, Data Analytics, Analytics, Python",https://www.naukri.com/job-listings-associate-vice-president-data-science-kpo-huquo-consulting-pvt-ltd-gurgaon-gurugram-7-to-12-years-291122905825
4,Data Science Professional,CliqHR Recruitment Services,Multiple,Skills Required-Required Skills:Experience of 3-8 years in Data Analytics and a mandato...,3-8 Yrs," Data Science, Ski, Data Analytics, Numpy, analytical, PowerPoint, Azure, communication",https://www.naukri.com/job-listings-data-science-professional-cliqhr-recruitment-services-mumbai-hyderabad-secunderabad-pune-chennai-delhi-ncr-3-to-8-years-291122904889
5,Data Science Lead,CliqHR Recruitment Services,Multiple,Required Experience: Minimum 5+ years of hands on experience using statistical computer...,5-10 Yrs," Data Science, analytical, R, written, data mining, verbal communication, Python, machine learning",https://www.naukri.com/job-listings-data-science-lead-cliqhr-recruitment-services-mumbai-hyderabad-secunderabad-pune-chennai-delhi-ncr-5-to-10-years-261122905540
6,Delivery Head - Analytics & Data Science,Okda Solutions,Gurgaon,"10+ years of experience in the delivery of Analytics, data science and machine learning...",8-13 Yrs," Analytics, machine learning, communication, analytical, data science, Delivery Management",https://www.naukri.com/job-listings-delivery-head-analytics-data-science-okda-solutions-gurgaon-gurugram-8-to-13-years-251122904495
7,Hiring For Senior / Lead Data Scientist - Data Science,Tiger Analytics,Permanent Remote,"A passion for writing high-quality code (Python) and the code should be modular, scalab...",5-10 Yrs," Data Science, Machine Learning, PowerPoint, SQL, Python, Excel, R, Artificial Intelligence",https://www.naukri.com/job-listings-hiring-for-senior-lead-data-scientist-data-science-tiger-analytics-chennai-5-to-10-years-291122005769
8,Data Science Lead - Forecasting,Cargill,Bangalore,"Bachelor s degree in Computer science, Statistics, Math OR related field OR Equivalent ...",5-7 Yrs," Data Science, Data analysis, Machine learning, Javascript, Workflow, Regression analysis, Forecasting, Monitoring",https://www.naukri.com/job-listings-data-science-lead-forecasting-cargill-india-pvt-ltd-bangalore-bengaluru-5-to-7-years-291122915436
9,ACN - Applied Intelligence - Finance - Data Science - 09,Accenture,Bangalore,The ideal candidate should have a strong client-facing consulting background in data sc...,3-5 Yrs," Computer science, Data analysis, Healthcare, SDK, Analytics, Publishing, Analytical, Machine learning",https://www.naukri.com/job-listings-acn-applied-intelligence-finance-data-science-09-accenture-solutions-pvt-ltd-bangalore-bengaluru-3-to-5-years-251122911193
10,Data Science Trainer,Patch The Skill,Bangalore,Trainer must be ready for 8 Hours daily Data Science Training with required gapsTrainin...,1-6 Yrs," Data Science, Data Engineering, Big Data, Data Analytics, Machine Learning, Excel, D, Artificial Intelligence",https://www.naukri.com/job-listings-data-science-trainer-patch-the-skill-bangalore-bengaluru-1-to-6-years-211122010550
11,Manager Data Science,Jio,Mumbai,Maximum 5 Years & above,5-8 Yrs," Report generation, Data management, Machine learning, Data structures, Business modeling, Mobile applications, Data warehousing, Predictive analytics",https://www.naukri.com/job-listings-manager-data-science-reliance-jio-infocomm-ltd-mumbai-5-to-8-years-021222501729
12,"Senior Manager, Data Science & ML Platform",Oportun,Remote,1 years of experience building and managing high performing data science teams includin...,7-12 Yrs," Administration, Direct marketing, Project management, Intellectual property, Project planning, Risk management, Digital marketing, Analytics",https://www.naukri.com/job-listings-senior-manager-data-science-ml-platform-oportun-inc-remote-7-to-12-years-021222502756
13,Associate Director - Data Science,Saaki Argus And Averil Consulting,Multiple,"Proven experience of getting machine learning assets into production, including UAT tes...",10-13 Yrs," scala, Python, Machine Learning, artificial intelligence",https://www.naukri.com/job-listings-associate-director-data-science-saaki-argus-and-averil-consulting-pune-gurgaon-gurugram-chennai-bangalore-bengaluru-mumbai-all-areas-10-to-13-years-301122006098
14,Data Science Analyst,EY Global Delivery Services India Llp,Multiple,Manager Data ScienceData and Analytics team is a multi-disciplinary technology team del...,8-12 Yrs," FMCG Marketing, Retail Analytics, Internet, machine learning, Data Analytics, Retail, data analysis, Data science analyst",https://www.naukri.com/job-listings-data-science-analyst-ey-global-delivery-services-india-llp-gurgaon-gurugram-bangalore-bengaluru-8-to-12-years-091122005338
15,Senior Business Intelligence Analyst - Data Science and Intelligence,Nippon Life India Asset Management Limited,Multiple,"Bachelors degree in Computer Science, a related technical field, or equivalent practica...",7-12 Yrs," data analysis, data science, business intelligence tools, python, data modeling, Data Architecture, artificial intelligence, sql",https://www.naukri.com/job-listings-senior-business-intelligence-analyst-data-science-and-intelligence-nippon-life-india-asset-management-limited-mumbai-suburban-thane-navi-mumbai-mumbai-all-areas-7-to-12-years-171122012301
16,Job Opening For Data Science Manager @ GlobalData(Hyd),Globaldata,Temp. WFH,"Hello, Hope you are doing good.Urgent job openings for Data Science Manager @ GlobalDat...",10-15 Yrs," Text Analytics, machine learning, deep learning, NLP, data science, python, caffe, reinforcement learning",https://www.naukri.com/job-listings-opening-for-data-science-manager-globaldata-hyd-globaldata-hyderabad-secunderabad-10-to-15-years-150922001821
17,Data Science & Analytics,V Konnect ,Mumbai,The role is expected to use analytical tools to identify opportunities to grow overall ...,15-18 Yrs," advanced analytics, Regulatory reporting, Underwriting, Analytical, Business analytics, Artificial Intelligence, Machine learning, Business strategy",https://www.naukri.com/job-listings-data-science-analytics-v-konnect-associates-mumbai-15-to-18-years-171122500887
18,Lead / Team Lead - Data Science - R/ Python/ Hive/ Spark,Info Corporate Service,Mumbai,Experience creating and using advanced machine learning algorithms and statistics: regr...,4-8 Yrs," Data Science, R, Python, CNN, SDE, Keras, LSTM, ggplot2",https://www.naukri.com/job-listings-lead-team-lead-data-science-r-python-hive-spark-info-corporate-service-mumbai-4-to-8-years-211122907746
19,Urgently looking For Data Science/ BI Analytics - Top Brand - Mumbai,Smart Source,Hybrid,"Experience in creating reports, dashboards, and stories in Tableau Good analytical unde...",4-9 Yrs," Data Science, Predictive Modeling, R, python, BI, neural networks, segmentation, logistic regression",https://www.naukri.com/job-listings-urgently-looking-for-data-science-bi-analytics-top-brand-mumbai-smart-source-mumbai-all-areas-4-to-9-years-241122006379
20,Head - Data Science & Analytics - Bank,Dimensions HRD Consultants,Gurgaon,Graduate / Post Graduate in Statistics / Economics / Engineering from premier college /...,12-16 Yrs," Data Science, Data Management, Analytics, Big Data, Data Mining, Data Modeling, Machine Learning",https://www.naukri.com/job-listings-head-data-science-analytics-bank-dimensions-hrd-consultants-gurgaon-gurugram-12-to-16-years-211122905301
21,Data Science Professional,GHARONDAA ADVISORS PVT LTD,Noida,"Good coding skills in front end, back end and other data layersExperience with CI / CD ...",5-10 Yrs," Data Science, deep learning, algorithms, front end, AI/ML, CI/CD, artificial intelligence",https://www.naukri.com/job-listings-data-science-professional-gharondaa-advisors-pvt-ltd-noida-5-to-10-years-011222912499
22,Lead- Data Science,Jardine Lloyd Thompson,Pune,Source data from disparate systems with good understanding of Qlik/ other BI tool archi...,3-6 Yrs," Payroll, Claims, data science, Coding, SSRS, Stored procedures, Risk management, Apache",https://www.naukri.com/job-listings-lead-data-science-jardine-lloyd-thompson-india-pvt-ltd-pune-3-to-6-years-011222501565
23,Data Science,GHARONDAA ADVISORS PVT LTD,Noida,Skillset Required : Implementing end to end data pipelines for serving reporting and da...,5-10 Yrs," Data Science, communication, CI / CD, CD, CI, AI, Order to Cash, Deep Learning",https://www.naukri.com/job-listings-data-science-gharondaa-advisors-pvt-ltd-noida-5-to-10-years-021222909628
24,Data Science Architect - ML / Data Mining,HyrEzy Talent Solutions,Gurgaon,"Job Role - Data Science ArchitectResponsibilities :- Analyze raw data, assessing qualit...",5-10 Yrs," Data Science, Power BI, Teradata, Data mining, Machine Learning, Deep Learning, Hortonworks, MapReduce",https://www.naukri.com/job-listings-data-science-architect-ml-data-mining-hyrezy-talent-solutions-gurgaon-gurugram-5-to-10-years-311022903019
25,Data Science Professional,Infosys,Bangalore,Bachelor of Engineering Good verbal & written communication skills articulate value of ...,4-8 Yrs," Data Science, Bigdata, Azure, written communication, Artificial Intelligence, GCP, >NLP Deep Learning, R",https://www.naukri.com/job-listings-data-science-professional-infosys-limited-bangalore-bengaluru-4-to-8-years-171122914168
26,ACN - Applied Intelligence - Finance - Data Science - 09,Accenture,Bangalore,Preferred Educational Background PhD / Masters / Bachelors degree in Statistics / Econo...,3-5 Yrs," Data analysis, Machine learning, Healthcare, SDK, Analytics, Publishing, Analytical, Vulnerability assessment",https://www.naukri.com/job-listings-acn-applied-intelligence-finance-data-science-09-accenture-solutions-pvt-ltd-bangalore-bengaluru-3-to-5-years-221122905706
27,Manager Data Science,Visa,Bangalore,"Experience planning, organizing, and managing multiple large projects with diverse cros...",6-11 Yrs," Automation, SAS, Campaign management, Risk analytics, Analytical, Consulting, Market intelligence, Business intelligence",https://www.naukri.com/job-listings-manager-data-science-visa-inc-bangalore-bengaluru-6-to-11-years-241122501198
28,"Assistant Manager - Data Science, Need Immediate Joiners",Citiustech,Multiple,"Work with OMICs, image, med device and RWE data to power various use cases in the areas...",5-10 Yrs," Data Science, NLP, Machine Learning, Python, Analytical, Data Modelling, R, Model Building",https://www.naukri.com/job-listings-assistant-manager-data-science-need-immediate-joiners-citiustech-pune-gurgaon-gurugram-bangalore-bengaluru-mumbai-all-areas-5-to-10-years-010822004921
29,Senior Data Analyst - Data Science and Intelligence,Nippon Life India Asset Management Limited,Multiple,"Bachelors degree in Computer Science, a related technical field, or equivalent practica...",7-12 Yrs," data science, python, data analysis, scala, sql",https://www.naukri.com/job-listings-senior-data-analyst-data-science-and-intelligence-nippon-life-india-asset-management-limited-mumbai-suburban-thane-navi-mumbai-mumbai-all-areas-7-to-12-years-171122011669
30,Data Science Trainee,Medtoureasy,Remote,This program will help anyone interested in pursuing a career in data science or machin...,0-1 Yrs," Data analysis, PDF, data science, Machine learning, Healthcare, data visualization, Budgeting, industrial training",https://www.naukri.com/job-listings-data-science-trainee-medtoureasy-remote-0-to-1-years-211122500264
31,Senior Analyst & AI Lead - Data Science,Huquo Consulting Pvt. Ltd,Delhi NCR,in Computer scienceInformation Technology ECE or other quantitative disciplines from ti...,10-15 Yrs," Data Science, R, Artificial Intelligence, Machine Learning, Deep Learning",https://www.naukri.com/job-listings-senior-analyst-ai-lead-data-science-huquo-consulting-pvt-ltd-faridabad-gurgaon-gurugram-10-to-15-years-181122910051
32,Senior Analyst & AI Lead - Data Science,Huquo Consulting Pvt. Ltd,Delhi NCR,in Computer scienceInformation Technology ECE or other quantitative disciplines from ti...,2-7 Yrs," Data Science, R, Artificial Intelligence, Machine Learning, Deep Learning",https://www.naukri.com/job-listings-senior-analyst-ai-lead-data-science-huquo-consulting-pvt-ltd-faridabad-gurgaon-gurugram-2-to-7-years-181122910046
33,"Software Trainees in Data Science, Data Analytics, .Net, Java, J2EE",MagicBase Royal BD Pvt Ltd  ,Bangalore,Only candidates who are available to work full time for a duration of at least 12 month...,0-1 Yrs," data analytics, Machine Learning, Python, IT Skills, Java, J2EE, Data Science, Big Data",https://www.naukri.com/job-listings-software-trainees-in-data-science-data-analytics-net-java-j2ee-magicbase-royal-bd-pvt-ltd-bangalore-bengaluru-0-to-1-years-101122005602
34,HEOR Data Analyst Role - SAS/SQL - Life Sciences,Huquo Consulting,Noida,Problem solving skills and experience constructing analytic solutions to business probl...,4-9 Yrs," SAS, Data Visualization, Data Analytics, Analytics, SQL, Data Management, Tableau, Statistics",https://www.naukri.com/job-listings-heor-data-analyst-role-sas-sql-life-sciences-huquo-consulting-noida-4-to-9-years-301122906453
35,Consultant - Data Science/Machine Learning Algorithms - KPO,PYLON Management Consulting Private Limited,Multiple,"Having minimum 4+ years of experience Strong programming experience in Python / R, atle...",4-7 Yrs," Machine Learning, Python, NLP, R, Data Science, Data Management, Operations",https://www.naukri.com/job-listings-consultant-data-science-machine-learning-algorithms-kpo-pylon-management-consulting-private-limited-pune-gurgaon-gurugram-bangalore-bengaluru-4-to-7-years-291122912328
36,Manager Data Science,Marriott,Pune,You understand the foundations of statistics and machine learning and can work in high ...,4-7 Yrs," CVS, Claims, Machine learning, Javascript, Agile, Oncology, Scrum, Epidemiology",https://www.naukri.com/job-listings-manager-data-science-marriott-pune-4-to-7-years-191122501038
37,"Data Science, NLP, Deep Learning Professional",Tech Mahindra,Pune,Individuals should be able to break down business problems into smaller components and ...,5-10 Yrs," Machine Learning, Python, Data science, skLearn, Deep Learning, keras, pytorch, pandas",https://www.naukri.com/job-listings-data-science-nlp-deep-learning-professional-tech-mahindra-ltd-pune-5-to-10-years-241122900139
38,SnapLogic Data Science Practitioner,Accenture,Mumbai,Educational Qualification : Bachelors degree and / or relevant experience required with...,2-4 Yrs," Consulting, JDBC, Informatica, Microsoft Dynamics, Oracle, REST, communication, SOAP",https://www.naukri.com/job-listings-snaplogic-data-science-practitioner-accenture-solutions-pvt-ltd-mumbai-2-to-4-years-221122905971
39,ACN - Applied Intelligence - CC - Data Science (IN) - 09,Accenture,Gurgaon,"6 years of data science experience using statistics, machine learning, or forecasting E...",2-6 Yrs," Consulting, Application development, Analytics, SQL, Python, Supply chain management, Version control, Machine learning",https://www.naukri.com/job-listings-acn-applied-intelligence-cc-data-science-in-09-accenture-solutions-pvt-ltd-gurgaon-gurugram-2-to-6-years-221122905918
40,ACN - Applied Intelligence - CC - Data Science (IN) - 07,Accenture,Gurgaon,At least 2-3 years of experience of leading junior team members on projects using suppl...,5-10 Yrs," Supply chain management, Consulting, Application development, SQL, Python, IT Skills, Data Science, Machine Learning",https://www.naukri.com/job-listings-acn-applied-intelligence-cc-data-science-in-07-accenture-solutions-pvt-ltd-gurgaon-gurugram-5-to-10-years-221122905924
41,ACN - Applied Intelligence - Finance - Data Science - 09,Accenture,Chennai,Preferred Educational Background PhD / Masters / Bachelors degree in Statistics / Econo...,3-5 Yrs," Data analysis, Machine learning, Healthcare, SDK, Analytics, Publishing, Analytical, Vulnerability assessment",https://www.naukri.com/job-listings-acn-applied-intelligence-finance-data-science-09-accenture-solutions-pvt-ltd-chennai-3-to-5-years-221122905704
42,ACN - Applied Intelligence - Finance - Data Science - 09,Accenture,Mumbai,Preferred Educational Background PhD / Masters / Bachelors degree in Statistics / Econo...,3-5 Yrs," Data analysis, Machine learning, Healthcare, SDK, Analytics, Publishing, Analytical, Vulnerability assessment",https://www.naukri.com/job-listings-acn-applied-intelligence-finance-data-science-09-accenture-solutions-pvt-ltd-mumbai-3-to-5-years-221122905703
43,ACN - Applied Intelligence - Finance - Data Science - 09,Accenture,Gurgaon,Preferred Educational Background PhD / Masters / Bachelors degree in Statistics / Econo...,3-5 Yrs," Data analysis, Machine learning, Healthcare, SDK, Analytics, Publishing, Analytical, Vulnerability assessment",https://www.naukri.com/job-listings-acn-applied-intelligence-finance-data-science-09-accenture-solutions-pvt-ltd-gurgaon-gurugram-3-to-5-years-221122905702
44,Data Science Intern/Co-Op,Brahma Consulting Group,Hyderabad,This position has a strong potential for full time hire as an associate data scientist ...,1-2 Yrs," Python, Predictive Modelling, R, Statistical Analysis, SQL, advanced analytics, data science, Intern",https://www.naukri.com/job-listings-data-science-intern-co-op-brahma-consulting-group-hyderabad-secunderabad-1-to-2-years-251122501700
45,Data Scientist - Healthcare / Life Sciences,TalentCo Search Pvt Ltd,Pune,"Experience of working on end-to-end data science pipeline: problem scoping, data gather...",3-8 Yrs," data science, R, AI/ML, EDA, data structures, machine learning, Python",https://www.naukri.com/job-listings-data-scientist-healthcare-life-sciences-talentco-search-pvt-ltd-pune-3-to-8-years-301122911345
46,Data Science,Sonata Software,Bangalore,Should have a Bachelor / Masters degree in Computer Science or Engineering or Statistic...,4-9 Yrs," IT Skills, Java, Python, Testing, Data Science, Machine Learning, Cloud, deep learning",https://www.naukri.com/job-listings-data-science-sonata-software-limited-bangalore-bengaluru-4-to-9-years-181122500006
47,"Senior Analyst, Data Science & Analytics",Transunion,Pune,"Bachelors (4 year) degree in statistics, applied mathematics, financial mathematics, en...",5-8 Yrs," IT Skills, Python, Machine Learning, Cloud, Project Management, Big Data, Tableau, Operations research",https://www.naukri.com/job-listings-senior-analyst-data-science-analytics-transunion-software-services-pvt-ltd-pune-5-to-8-years-071022500378
48,Configuration Owner - Data Science,Cognoticai Consulting,Hybrid,Demonstrable Expertise in AWS with at least one certification Proficiency with Databric...,3-7 Yrs," data science, terraform, Data Bricks, gitlab, aws cloudformation",https://www.naukri.com/job-listings-configuration-owner-data-science-cognoticai-consulting-pune-3-to-7-years-251122005555
49,Associate Solution Leader - Data Science,Brane Enterprises,Hybrid,Description: We are looking for an Associate Solution Leader Data Science to join our g...,5-10 Yrs," data scientist, NLP, Natural Language Processing, Computer Vision, Machine Learning, Deep Learning",https://www.naukri.com/job-listings-associate-solution-leader-data-science-brane-enterprises-hyderabad-secunderabad-5-to-10-years-291122012809
50,Hiring For Data Science Manager,Evoke Technologies,Hybrid,7+ years experience in AI / ML algorithm development workflow and data analysis in the ...,10-15 Yrs," deep learning, computer vision, AWS SageMaker, LSTMs, Azure, Keras, CNNs, model tuning",https://www.naukri.com/job-listings-hiring-for-data-science-manager-evoke-technologies-hyderabad-secunderabad-10-to-15-years-281122010447
51,Lead/Manager - Data Science,Brahma Consulting Group,Hyderabad,Our Data Science Manager should be able to work independently from gathering requiremen...,7-12 Yrs," Data analysis, data science, SAS, Consulting, Predictive modeling, Data mining, Forecasting, Operations",https://www.naukri.com/job-listings-lead-manager-data-science-brahma-consulting-group-hyderabad-secunderabad-7-to-12-years-251122501736
52,Lead Data Science,Pitney Bowes (PBI),Mumbai,Deliver analytics initiatives to address business problems with the ability to determin...,5-9 Yrs," IT Skills, Testing, Data Science, Machine Learning, Big Data, Supply chain, Data analysis, Analytical",https://www.naukri.com/job-listings-lead-data-science-pitney-bowes-india-pvt-ltd-mumbai-5-to-9-years-241122500814
53,CarbyneTech - Data Science Engineer - Machine/Deep Learning Models,CarbyneTech India,Hyderabad,Hands-on experience in implementing Deep learning models with textual data/ time series...,4-8 Yrs," Brand Management, Advertising, Marketing, Tensorflow, R, Big Data, Numpy, Python",https://www.naukri.com/job-listings-carbynetech-data-science-engineer-machine-deep-learning-models-carbynetech-india-hyderabad-secunderabad-4-to-8-years-291122908063
54,Data Science Professional,CliqHR Recruitment Services,Multiple,Experience of 3-8 years in Data Analytics and a mandatory 2-3 years in Retail / CPG Ana...,3-8 Yrs," Data Science, Python, communication, analytical, Azure, Ski, Pandas, HTML",https://www.naukri.com/job-listings-data-science-professional-cliqhr-recruitment-services-mumbai-hyderabad-secunderabad-pune-chennai-delhi-ncr-3-to-8-years-291122904892
55,Data Science Professional - Contract To Hire,SuccessR Hrtech Pvt Ltd,Temp. WFH,"Experience with common data science toolkits, such as R, Weka, NumPy, MatLab, etc {{dep...",4-8 Yrs," Data Science, IT Skills, Testing, Machine Learning, data analysis, data mining, Nosql db, query languages",https://www.naukri.com/job-listings-data-science-professional-contract-to-hire-successr-hrtech-pvt-ltd-bangalore-bengaluru-4-to-8-years-211122901850
56,Data Science,Legato Healthcare,Multiple,Minimum of 3 years of experience working with large data sets or do large scale quantit...,8-12 Yrs," US Healthcare, Data Science, Big Data, Spark, Orschestration frame work, machine learning, Deep Learning",https://www.naukri.com/job-listings-data-science-legato-healthcare-hyderabad-secunderabad-gurgaon-gurugram-bangalore-bengaluru-8-to-12-years-241122004846
57,Principal Engineer Data Science II AI models II Machine Learning,People Resources,Bangalore,8+ Years experience in developing AI modelsStrong knowledge in Machine Learning & Deep ...,8-13 Yrs," Data Processing, Machine Learning, ETL, R, Scala, Tableau, SQL, Python",https://www.naukri.com/job-listings-principal-engineer-data-science-ii-ai-models-ii-machine-learning-people-resources-bangalore-bengaluru-8-to-13-years-211122601173
58,Manager - Data Science - Biomass Technology Firm,Grok,Multiple,"On the technical side, you will initiate new machine learning initiatives, including sc...",5-10 Yrs," Content Writing, Editorial, data science, Machine learning, Data collection, Manager Technology, Instrumentation, Hardware",https://www.naukri.com/job-listings-manager-data-science-biomass-technology-firm-grok-kolkata-mumbai-hyderabad-secunderabad-pune-chennai-bangalore-bengaluru-delhi-ncr-5-to-10-years-241122904768
59,Senior Manager - Data Science,Tredence,Multiple,Solve some of the most impactful business problems for our clients. Lead multiple teams...,5-8 Yrs," Data management, data science, GCP, Machine learning, Natural language processing, Data analytics, data visualization, Data mining",https://www.naukri.com/job-listings-senior-manager-data-science-tredence-analytics-solutions-private-limited-chennai-gurgaon-gurugram-bangalore-bengaluru-5-to-8-years-270922501604
60,Data Science Lead,Koch Industries,Bangalore,A successful candidate will bring advanced knowledge of best-in-class data science meth...,4-7 Yrs," BPO, data analysis, Supply chain, data science, SAS, Consulting, Machine learning, Data analytics",https://www.naukri.com/job-listings-data-science-lead-koch-technology-center-bangalore-bengaluru-4-to-7-years-291022500391
61,Lead - Analytics & Data Science,Cadenz.ai,Bangalore,"The Data Science Team in TDT is expected to build fitting analytics, BI and ML solution...",15-20 Yrs," IT Skills, Python, Data Science, Machine Learning, Cloud, Big Data, AWS, deep learning",https://www.naukri.com/job-listings-lead-analytics-data-science-cadenz-ai-bangalore-bengaluru-15-to-20-years-080822500135
